Issue,Possible Causes,Diagnostic Steps,Effects on Car,Recommended Action,,,,,
Engine Misfiring,"- Faulty spark plug, - Malfunctioning fuel injector",1. Check spark plugs for wear or damage. 2. Test fuel injectors for proper operation. 3. Inspect ignition coils for cracks or malfunction. 4. Perform a compression test to check cylinder health.,- Reduced fuel economy - Potential safety hazards due to loss of power - Risk of engine damage if not addressed promptly,- Replace faulty spark plugs as needed. - Address worn cylinders through engine repair or replacement. - Seek professional assistance for diagnosis and repair if necessary.,,,,,
Engine Overheating,"- Cooling system leak, - Faulty water pump, - Bad radiator, - Low engine oil level, - Thermostat failure","1. Inspect for coolant leaks from hoses, gaskets, engine block, and radiator. 2. Check water pump for proper operation and impeller condition. 3. Examine radiator for blockages, damaged fins, or leaks. 4. Verify engine oil level and address any leaks. 5. Test thermostat functionality and replace if malfunctioning.",- Elevated engine temperature - Risk of permanent engine damage if not addressed promptly,"- Regularly inspect cooling system components for leaks and damage. - Replace faulty parts such as hoses, gaskets, water pump, and radiator. - Maintain proper engine oil level and replace worn components. - Test and replace thermostat if necessary. - Seek professional assistance for diagnosis and repair if needed.",,,,,
Engine Knocking/Tapping,"- Low engine oil level, - Engine bearing failure, - Excessive crankshaft end-play, - Torque converter and flexplate issues",1. Check engine oil level and refill if low. 2. Inspect engine bearings for wear and damage. 3. Measure crankshaft end-play and assess for excessive clearance. 4. Examine torque converter and flexplate for loose or missing mounting bolts.,- Risk of permanent engine damage - Reduced engine performance and efficiency,- Check and refill engine oil if low. - Inspect engine bearings and replace if damaged. - Address excessive crankshaft end-play. - Tighten or replace torque converter and flexplate mounting bolts as needed.,,,,,
Engine Rattling,"- Low engine oil level, - Loose timing chain, - Faulty variable valve timing actuator, - Loose heat shield",1. Verify engine oil level and refill if low. 2. Inspect timing chain for proper tension and replace if loose or damaged. 3. Check variable valve timing actuator for malfunction and replace if necessary. 4. Tighten or replace loose heat shield components.,- Potential internal engine damage - Reduced engine performance and efficiency,- Ensure engine oil level is adequate and refill if necessary. - Replace timing chain if loose or damaged. - Address faulty variable valve timing actuator. - Tighten or replace loose heat shield components.,,,,,
Driving with Knocking Engine,- Continuing to drive with a knocking engine can lead to further damage and potentially catastrophic engine failure.,"- If the engine is knocking, stop driving immediately and have the vehicle towed to a repair shop. - Continuing to drive with a knocking engine increases the risk of severe engine damage and costly repairs.",- Risk of complete engine failure - Increased repair costs and potential safety hazards,- Stop driving immediately if the engine is knocking. - Have the vehicle towed to a repair shop for diagnosis and repair. - Avoid driving until the issue is resolved to prevent further damage and ensure safety.,,,,,
Transmission slipping,"- Low transmission fluid level, - Worn out or damaged transmission bands/clutches, - Faulty torque converter, - Transmission fluid contamination","1. Check transmission fluid level using dipstick, 2. Perform a visual inspection of transmission components for wear or damage, 3. Test torque converter for proper operation, 4. Inspect transmission fluid for signs of contamination (e.g., debris)","- Loss of acceleration, - Difficulty maintaining speed, - Overheating transmission fluid, - Unusual noises during gear changes","- Top up transmission fluid if low, - Replace worn or damaged transmission bands/clutches, - Replace torque converter if faulty, - Flush and replace contaminated transmission fluid",,,,,
Delayed shifting,"- Low transmission fluid level, - Faulty shift solenoids, - Clogged transmission filter, - Worn clutch plates or bands","1. Check transmission fluid level using dipstick, 2. Test shift solenoids for proper functioning, 3. Remove and inspect transmission filter for blockages, 4. Perform a visual inspection of clutch plates or bands for wear","- Delayed engagement of gears, - Jerky or rough shifting, - Reduced fuel efficiency, - Transmission warning light illuminated","- Top up transmission fluid if low, - Replace faulty shift solenoids, - Replace clogged transmission filter, - Replace worn clutch plates or bands",,,,,
Transmission fluid leaks,"- Damaged transmission pan or gasket, - Loose or damaged transmission fluid lines, - Faulty transmission seals, - Overfilled transmission fluid","1. Visually inspect transmission pan and gasket for signs of damage, 2. Check transmission fluid lines for tightness and signs of damage, 3. Inspect transmission seals for signs of wear or leakage, 4. Verify transmission fluid level and check for signs of overfilling","- Puddles of fluid under the vehicle, - Low transmission fluid level, - Transmission slipping, - Transmission overheating","- Replace damaged transmission pan or gasket, - Tighten or replace loose or damaged transmission fluid lines, - Replace faulty transmission seals, - Drain excess transmission fluid to correct level",,,,,
Difficulty shifting gears,"- Low transmission fluid level, - Worn or damaged shift linkage, - Contaminated transmission fluid, - Faulty transmission control module","1. Check transmission fluid level using dipstick, 2. Perform a visual inspection of shift linkage for wear or damage, 3. Inspect transmission fluid for signs of contamination (e.g., debris), 4. Use diagnostic tool to scan for error codes related to transmission control module","- Grinding or scraping noises during shifting, - Inability to shift into certain gears, - Erratic or unpredictable gear changes, - Transmission warning light illuminated","- Top up transmission fluid if low, - Replace worn or damaged shift linkage components, - Flush and replace contaminated transmission fluid, - Repair or replace faulty transmission control module as necessary",,,,,
Transmission warning lights,"- Faulty transmission sensors, - Electrical issues, - Internal transmission faults","1. Use diagnostic tool to scan for error codes related to transmission sensors, 2. Check electrical connections and wiring harness for signs of damage, 3. Perform diagnostic tests to identify internal transmission malfunction","- Limited or no access to certain gears, - Reduced engine power, - Transmission stuck in limp mode","- Replace faulty transmission sensors, - Repair or replace damaged electrical components, - Seek professional assistance for diagnosis and repair",,,,,
Brake noise,"Squealing, grinding, etc.",1. Inspect brake pads and rotors for wear or damage. 2. Check for loose or worn brake components.,- Decreased braking performance - Increased risk of accidents due to reduced stopping power - Potential damage to braking system components,- Replace worn brake pads and rotors as needed. - Address any loose or worn brake components. - Seek professional assistance for diagnosis and repair if necessary.,,,,,
Soft or spongy brake pedal,"Air in brake lines, Brake fluid leak, Worn brake components",1. Check brake fluid level and condition. 2. Inspect brake lines for leaks or damage. 3. Check brake pads and rotors for wear or damage.,- Reduced braking effectiveness - Longer stopping distances - Increased risk of accidents due to decreased responsiveness of brakes,- Bleed brake lines to remove air bubbles. - Repair any leaks in the brake system. - Replace worn brake components. - Seek professional assistance for diagnosis and repair if necessary.,,,,,
Brake fluid leaks,"Damaged brake lines or hoses, Worn brake seals","1. Inspect brake lines, hoses, and seals for signs of leakage. 2. Check brake fluid level and condition.",- Reduced braking effectiveness - Potential loss of braking ability if fluid level becomes too low,"- Repair or replace damaged brake lines, hoses, or seals. - Top up brake fluid reservoir as needed. - Seek professional assistance for diagnosis and repair if necessary.",,,,,
Uneven brake wear,"Misaligned brake calipers, Worn suspension components",1. Inspect brake pads and rotors for uneven wear. 2. Check suspension components for wear or damage.,- Reduced braking effectiveness - Increased stopping distances - Uneven braking performance,- Adjust or replace brake calipers as needed. - Address any worn suspension components. - Seek professional assistance for diagnosis and repair if necessary.,,,,,
ABS system malfunctions,"Faulty ABS sensors, ABS module failure",1. Use diagnostic tool to scan for ABS system error codes. 2. Inspect ABS sensors and wiring for damage.,- Loss of ABS functionality - Increased risk of skidding during braking - ABS warning light illuminated on dashboard,- Replace faulty ABS sensors or module as needed. - Repair damaged wiring. - Seek professional assistance for diagnosis and repair if necessary.,,,,,
Tire wear patterns,"Uneven wear, bald spots",1. Inspect tires for signs of uneven wear or bald spots. 2. Check tire pressure and alignment.,- Reduced traction and handling - Increased risk of blowouts or tire failure - Poor fuel efficiency,- Rotate tires regularly to promote even wear. - Address any alignment issues. - Replace worn tires as needed. - Seek professional assistance for diagnosis and repair if necessary.,,,,,
Tire pressure issues,"Underinflation, overinflation",1. Use a tire pressure gauge to check individual tire pressure. 2. Refer to vehicle owner's manual for recommended tire pressure.,- Reduced fuel efficiency - Uneven tire wear - Increased risk of tire blowouts,- Inflate tires to recommended pressure levels. - Regularly check tire pressure and adjust as needed. - Replace damaged or leaking valves or seals. - Seek professional assistance for diagnosis and repair if necessary.,,,,,
Wheel alignment problems,Misaligned suspension components,1. Perform visual inspection of tire wear patterns. 2. Use alignment equipment to measure and adjust wheel alignment.,- Uneven tire wear - Poor vehicle handling and steering response - Increased fuel consumption,- Perform wheel alignment adjustment as needed. - Inspect and replace any worn or damaged suspension components. - Seek professional assistance for diagnosis and repair if necessary.,,,,,
Bent or damaged wheels,"Impact with potholes, curbs, or debris",1. Visually inspect wheels for signs of bends or damage. 2. Use wheel balancing equipment to check for irregularities.,- Vibrations while driving - Decreased handling and stability - Potential tire damage and air leaks,- Replace bent or damaged wheels as needed. - Balance wheels to ensure proper weight distribution. - Seek professional assistance for diagnosis and repair if necessary.,,,,,
Vibrations at certain speeds,"Wheel imbalance, worn suspension components",1. Perform visual inspection of tire and wheel assemblies. 2. Check suspension components for wear or damage.,- Vibrations felt in steering wheel or vehicle body - Reduced comfort and ride quality - Increased tire wear,- Balance wheels to correct any imbalances. - Inspect and replace worn suspension components as needed. - Seek professional assistance for diagnosis and repair if necessary.,,,,,
Fuel leaks,"Damaged fuel lines, loose connections",1. Inspect fuel lines and connections for signs of leaks. 2. Use a fuel pressure tester to check for leaks.,- Fire hazard - Reduced fuel efficiency - Strong odor of gasoline,- Repair or replace damaged fuel lines or connections. - Tighten loose connections. - Seek professional assistance for diagnosis and repair if necessary.,,,,,
Fuel pump failure,"Electrical issues, worn components",1. Check for power at the fuel pump connector. 2. Test fuel pressure using a pressure gauge.,- Engine stalling or hesitation during acceleration - Difficulty starting the engine - Poor performance,- Replace faulty fuel pump components as needed. - Check electrical connections and wiring for issues. - Seek professional assistance for diagnosis and repair if necessary.,,,,,
Fuel gauge inaccuracies,"Faulty sending unit, wiring issues",1. Inspect wiring and connections to the fuel gauge. 2. Test the fuel sending unit for proper operation.,- Inaccurate fuel level readings on the dashboard - Difficulty monitoring fuel consumption,- Replace faulty sending unit or repair wiring as needed. - Calibrate or replace the fuel gauge if necessary. - Seek professional assistance for diagnosis and repair if necessary.,,,,,
Fuel injector issues,"Clogged injectors, electrical problems",1. Perform fuel injector flow test to check for clogs. 2. Use a scan tool to check injector operation.,- Engine misfires - Poor fuel economy - Rough idling,- Clean or replace clogged fuel injectors as needed. - Check injector wiring and connections for issues. - Seek professional assistance for diagnosis and repair if necessary.,,,,,
Vapor lock,"High underhood temperatures, fuel system design flaws",1. Allow the engine to cool down. 2. Check for kinks or restrictions in fuel lines.,- Engine stalling or hesitation - Difficulty starting the engine - Rough idling,- Insulate fuel lines to prevent heat transfer. - Ensure proper routing of fuel lines to minimize bends and restrictions. - Seek professional assistance for diagnosis and repair if necessary.,,,,,
Oil leaks,"Worn seals, damaged gaskets",1. Inspect engine for oil leaks around gaskets and seals. 2. Use UV dye and black light for detection.,- Reduced oil level - Engine overheating - Smoke or burning smell from engine bay,- Replace worn seals or gaskets. - Tighten loose connections. - Seek professional assistance for diagnosis and repair if necessary.,,,,,
Coolant leaks,"Cracked hoses, radiator damage",1. Check coolant hoses and radiator for visible damage. 2. Perform pressure test on cooling system.,- Engine overheating - Coolant odor inside or outside the vehicle - Low coolant level in reservoir,- Replace damaged hoses or radiator components. - Repair or replace damaged gaskets. - Seek professional assistance for diagnosis and repair if necessary.,,,,,
Transmission fluid leaks,"Worn seals, damaged transmission pan",1. Inspect transmission pan and seals for signs of leaks. 2. Check transmission fluid level and condition.,- Transmission slipping or hesitation - Low transmission fluid level - Burning smell from transmission,- Replace worn seals or gaskets. - Repair or replace damaged transmission pan. - Seek professional assistance for diagnosis and repair if necessary.,,,,,
Power steering fluid leaks,"Leaking hoses, damaged power steering pump",1. Inspect power steering system components for visible leaks. 2. Check power steering fluid level.,- Difficulty steering - Whining noise when turning the steering wheel - Low power steering fluid level,- Replace damaged hoses or power steering pump. - Repair or replace damaged seals. - Seek professional assistance for diagnosis and repair if necessary.,,,,,
Brake fluid leaks,"Corroded brake lines, damaged brake calipers",1. Inspect brake lines and calipers for signs of leaks. 2. Check brake fluid level and condition.,- Reduced braking performance - Soft or spongy brake pedal - Low brake fluid level in reservoir,- Replace corroded brake lines or damaged calipers. - Repair or replace damaged seals. - Seek professional assistance for diagnosis and repair if necessary.,,,,,
Airbag warning lights,"Faulty airbag sensors, wiring issues",1. Scan vehicle's computer for airbag fault codes. 2. Inspect airbag system wiring and connections.,- Inoperative airbag system - Increased risk of injury in the event of a collision,- Repair or replace faulty airbag sensors. - Check and repair wiring issues. - Seek professional assistance for diagnosis and repair if necessary.,,,,,
ABS system faults,"Malfunctioning ABS sensors, hydraulic issues",1. Use diagnostic tool to retrieve ABS fault codes. 2. Inspect ABS sensor wiring and connections.,- Reduced braking performance - Increased risk of skidding during braking,- Replace malfunctioning ABS sensors. - Check and repair hydraulic system components. - Seek professional assistance for diagnosis and repair if necessary.,,,,,
Traction control issues,"Faulty wheel speed sensors, traction control module failure",1. Check traction control system for fault codes. 2. Inspect wheel speed sensors for damage.,- Loss of traction control functionality - Increased risk of loss of vehicle control in slippery conditions,- Replace faulty wheel speed sensors. - Replace malfunctioning traction control module. - Seek professional assistance for diagnosis and repair if necessary.,,,,,
Collision avoidance system malfunctions,"Sensor calibration issues, software glitches",1. Perform system recalibration if applicable. 2. Update system software to the latest version.,- Inoperative collision avoidance system - Increased risk of collision due to lack of warning,- Recalibrate sensors or update system software as necessary. - Seek professional assistance for diagnosis and repair if necessary.,,,,,
Blind-spot monitoring failures,"Sensor obstruction, electrical issues",1. Inspect blind-spot monitoring sensors for obstructions. 2. Check electrical connections for faults.,- Inoperative blind-spot monitoring system - Increased risk of collision while changing lanes,- Remove obstructions from sensors. - Check and repair electrical connections. - Seek professional assistance for diagnosis and repair if necessary.,,,,,
Electrical Problems: Battery,"Corroded terminals, faulty alternator",1. Check battery terminals for corrosion. 2. Test battery voltage and charging system.,- Difficulty starting the engine - Dim or flickering lights,- Clean battery terminals or replace corroded cables. - Test battery and charging system. - Replace faulty alternator if necessary.,,,,,
Electrical Problems: Wiring,"Damaged or frayed wires, poor connections",1. Inspect wiring harnesses for visible damage. 2. Test electrical circuits for continuity.,- Intermittent electrical failures - Electrical components not functioning properly,- Repair or replace damaged wiring. - Ensure all electrical connections are secure and properly connected. - Seek professional assistance for diagnosis and repair if necessary.,,,,,
Ignition Problems,"Faulty ignition switch, worn-out key",1. Test ignition switch for proper operation. 2. Check key for signs of wear.,- Engine not starting or intermittent starting issues - Inability to turn the ignition key,- Replace faulty ignition switch if necessary. - Replace worn-out key. - Seek professional assistance for diagnosis and repair if necessary.,,,,,
Clutch Problems,"Worn clutch disc, faulty clutch master cylinder",1. Check clutch pedal for sponginess or resistance. 2. Test clutch engagement and disengagement.,- Difficulty shifting gears - Slipping or jerking when accelerating,- Replace worn clutch disc. - Inspect and replace faulty clutch master cylinder if necessary. - Seek professional assistance for diagnosis and repair if necessary.,,,,,
Automatic Transmission Slipping,"Low transmission fluid, worn clutch plates",1. Check transmission fluid level and condition. 2. Perform a transmission pressure test.,- Delayed or rough shifting between gears - Loss of acceleration or power,- Top up or replace transmission fluid as necessary. - Inspect and replace worn clutch plates. - Seek professional assistance for diagnosis and repair if necessary.,,,,,
Flat tire,Puncture or damage to tire,1. Inspect tire for punctures or damage. 2. Assess tire pressure.,- Inability to drive due to flat tire - Risk of further damage if driven on flat tire,- Replace flat tire or repair puncture. - Inflate tire to recommended pressure or replace if damaged beyond repair. - Seek professional assistance for tire repair or replacement if necessary.,,,,,
Oil Change,Dirty or low engine oil,1. Check engine oil level and condition. 2. Inspect for signs of contamination or degradation.,- Increased engine wear - Reduced engine performance - Potential engine damage,- Replace engine oil and oil filter at recommended intervals. - Use high-quality engine oil suitable for your vehicle. - Follow manufacturer recommendations for oil change intervals.,,,,,
Tire Rotation,Uneven tire wear,1. Inspect tire tread depth and wear patterns. 2. Rotate tires according to manufacturer guidelines.,- Prolonged tire life - Improved handling and traction - Enhanced fuel efficiency,"- Rotate tires regularly as recommended by the vehicle manufacturer. - Follow specific rotation patterns based on tire type (e.g., front-wheel drive, rear-wheel drive). - Consider alignment check and adjustment if uneven wear persists.",,,,,
Air Filter Replacement,Dirty or clogged air filter,1. Remove and inspect air filter for dirt and debris. 2. Replace air filter if necessary.,- Improved engine performance - Better fuel efficiency - Reduced emissions,- Replace air filter according to manufacturer recommendations. - Consider more frequent replacements in dusty or polluted environments. - Ensure proper installation and seating of the new air filter.,,,,,
Battery Draining Quickly,- Faulty alternator,1. Test battery voltage with engine running and off. 2. Check alternator output using a multimeter.,- Difficulty starting the engine - Dimming lights - Electrical malfunctions,- Replace faulty alternator. - Test and replace battery if necessary. - Check for electrical system issues.,,,,,
Rough Idle,- Dirty air filter,1. Inspect air filter for dirt and clogs. 2. Check throttle body for carbon buildup.,- Engine shaking or vibrating - Fluctuating RPMs - Stalling at idle,- Replace air filter if dirty. - Clean throttle body. - Check for vacuum leaks. - Test and replace idle control valve if necessary.,,,,,
Squealing Brakes,- Worn brake pads,1. Inspect brake pads for thickness and wear. 2. Check brake rotors for scoring or warping.,- Screeching or squealing noise when braking - Reduced braking performance,- Replace worn brake pads. - Resurface or replace brake rotors if damaged.,,,,,
Engine Stalling,- Clogged fuel filter,1. Test fuel pressure at fuel rail. 2. Inspect fuel filter for clogs.,- Engine shutting off unexpectedly while driving - Difficulty restarting the engine,- Replace clogged fuel filter. - Test and replace fuel pump if necessary. - Check for other fuel delivery issues.,,,,,
Dashboard Warning Lights,- Various electrical faults,1. Use diagnostic scanner to retrieve error codes. 2. Check battery voltage and charging system.,- Illumination of various warning lights on the dashboard - Erratic gauge readings,- Scan vehicle's computer for error codes. - Test and replace faulty sensors or modules. - Check electrical connections.,,,,,
Engine Oil Leaks,- Worn valve cover gasket,1. Inspect valve cover gasket for signs of leakage. 2. Check oil pan gasket and rear main seal.,- Oil spots or puddles under the vehicle - Burning smell from the engine bay,- Replace worn valve cover gasket. - Repair or replace damaged oil pan gasket or rear main seal. - Check for other sources of leaks.,,,,,
Steering Wheel Vibrations,- Unbalanced tires,1. Inspect tire tread wear and measure tire pressure. 2. Check wheel alignment and balance.,- Vibrations felt in the steering wheel or vehicle body - Uneven tire wear,- Balance and rotate tires. - Align wheels. - Inspect suspension components for wear.,,,,,
Engine Hesitation,- Faulty mass airflow sensor,1. Test mass airflow sensor using multimeter or scan tool. 2. Check for vacuum leaks.,- Delayed or sluggish acceleration - Jerking or bucking during acceleration,- Test and replace faulty mass airflow sensor. - Check for and repair vacuum leaks. - Inspect throttle body and clean if necessary.,,,,,
Exhaust Smoke,- Burning oil or coolant,1. Inspect exhaust system for leaks or damage. 2. Check oil and coolant levels and condition.,"- Blue smoke: Burning oil smell, indicates oil leakage or consumption - White smoke: Sweet smell, indicates coolant leakage or burning",- Address oil leaks or consumption issues. - Repair coolant leaks. - Perform compression test to check engine health.,,,,,
Transmission Shifting Issues,- Low transmission fluid level,1. Check transmission fluid level and condition. 2. Inspect transmission mounts and linkage.,- Difficulty shifting gears - Erratic or delayed gear changes - Transmission slipping,- Top up or replace transmission fluid as necessary. - Inspect and replace worn transmission mounts or linkage. - Check for other transmission issues.,,,,,
Suspension Noise,- Worn shock absorbers,1. Inspect shock absorbers for leaks or damage. 2. Test suspension components for play or wear.,- Knocking or clunking noises over bumps or rough roads - Poor ride quality,- Replace worn shock absorbers. - Inspect and replace other worn suspension components. - Perform alignment check.,,,,,
Engine Smoking,- Overheating engine,1. Check coolant level and condition. 2. Test radiator cap and thermostat.,- Smoke emanating from the engine bay - Burning smell,- Address overheating issue. - Check for coolant leaks. - Perform cooling system flush. - Inspect for other sources of smoke.,,,,,
Air Conditioning Not Cooling,- Low refrigerant level,1. Check refrigerant level using pressure gauge. 2. Inspect AC compressor and condenser for leaks or damage.,- Warm air blowing from AC vents - Inconsistent cooling performance,- Recharge AC system with refrigerant. - Repair leaks in AC components. - Test and replace faulty compressor or condenser.,,,,,
